{
  "version": "1.0.0",
  "metadata": {
    "architecture": "hailo15h",
    "content_hash": "b076f9762845cc80a85f96759e5b6377c4ace6aa37c57fe464a04ca1d50ffa16",
    "description": "",
    "generation_timestamp": "2025-11-25T11:36:55.790455+00:00"
  },
  "application_settings": "/etc/imaging/cfg/hailo15h/imx715/theia_sl410m/4k/profiles/lowlight/ai_example_lowlight_bayer/application_settings.json",
  "encoded_output_streams": [
    {
      "encoding": "/etc/imaging/cfg/hailo15h/imx715/theia_sl410m/4k/profiles/lowlight/ai_example_lowlight_bayer/encoder_sink0.json",
      "masking": "/etc/imaging/cfg/hailo15h/imx715/theia_sl410m/4k/profiles/lowlight/ai_example_lowlight_bayer/masking_sink0.json",
      "osd": "/etc/imaging/cfg/hailo15h/imx715/theia_sl410m/4k/profiles/lowlight/ai_example_lowlight_bayer/osd_sink0.json",
      "stream_id": "sink0"
    },
    {
      "encoding": "/etc/imaging/cfg/hailo15h/imx715/theia_sl410m/4k/profiles/lowlight/ai_example_lowlight_bayer/encoder_sink1.json",
      "masking": "/etc/imaging/cfg/hailo15h/imx715/theia_sl410m/4k/profiles/lowlight/ai_example_lowlight_bayer/masking_sink1.json",
      "osd": "/etc/imaging/cfg/hailo15h/imx715/theia_sl410m/4k/profiles/lowlight/ai_example_lowlight_bayer/osd_sink1.json",
      "stream_id": "sink1"
    }
  ],
  "iq_settings": "/etc/imaging/cfg/hailo15h/imx715/theia_sl410m/4k/profiles/lowlight/ai_example_lowlight_bayer/iq_settings.json",
  "sensor_config": "/etc/imaging/cfg/hailo15h/imx715/theia_sl410m/4k/profiles/lowlight/ai_example_lowlight_bayer/sensor_config.json",
  "stabilizer_settings": "/etc/imaging/cfg/hailo15h/imx715/theia_sl410m/4k/profiles/lowlight/ai_example_lowlight_bayer/stabilizer_settings.json"
}
