{
  "version": "1.0.0",
  "metadata": {
    "architecture": "hailo15l",
    "content_hash": "c5f256ba91f023dcfece514047ed6bff29cfb4af54ea80a3bd64c364d9b66098",
    "description": "",
    "generation_timestamp": "2025-11-30T13:04:29.603163+00:00"
  },
  "application_settings": "/etc/imaging/cfg/hailo15l/imx678/theia_sl410m/4k/profiles/lowlight/webserver_lowlight_bayer_hdr/application_settings.json",
  "encoded_output_streams": [
    {
      "encoding": "/etc/imaging/cfg/hailo15l/imx678/theia_sl410m/4k/profiles/lowlight/webserver_lowlight_bayer_hdr/encoder_sink0.json",
      "masking": "/etc/imaging/cfg/hailo15l/imx678/theia_sl410m/4k/profiles/lowlight/webserver_lowlight_bayer_hdr/masking_sink0.json",
      "osd": "/etc/imaging/cfg/hailo15l/imx678/theia_sl410m/4k/profiles/lowlight/webserver_lowlight_bayer_hdr/osd_sink0.json",
      "stream_id": "sink0"
    }
  ],
  "iq_settings": "/etc/imaging/cfg/hailo15l/imx678/theia_sl410m/4k/profiles/lowlight/webserver_lowlight_bayer_hdr/iq_settings.json",
  "sensor_config": "/etc/imaging/cfg/hailo15l/imx678/theia_sl410m/4k/profiles/lowlight/webserver_lowlight_bayer_hdr/sensor_config.json",
  "stabilizer_settings": "/etc/imaging/cfg/hailo15l/imx678/theia_sl410m/4k/profiles/lowlight/webserver_lowlight_bayer_hdr/stabilizer_settings.json"
}
