{
  "version": "1.0.0",
  "metadata": {
    "architecture": "hailo15h",
    "content_hash": "f31bfcd3eefc67104184d77b961df221b74821c142c3a92f0be1f7bcceb29255",
    "description": "",
    "generation_timestamp": "2025-11-24T12:15:21.734275+00:00"
  },
  "application_settings": "/etc/imaging/cfg/hailo15h/imx678/kit/4k/profiles/lowlight/lowlight_r0225c8/application_settings.json",
  "encoded_output_streams": [
    {
      "encoding": "/etc/imaging/cfg/hailo15h/imx678/kit/4k/profiles/lowlight/lowlight_r0225c8/encoder_sink0.json",
      "masking": "",
      "osd": "/etc/imaging/cfg/hailo15h/imx678/kit/4k/profiles/lowlight/lowlight_r0225c8/osd_sink0.json",
      "stream_id": "sink0"
    },
    {
      "encoding": "/etc/imaging/cfg/hailo15h/imx678/kit/4k/profiles/lowlight/lowlight_r0225c8/encoder_sink1.json",
      "masking": "",
      "osd": "/etc/imaging/cfg/hailo15h/imx678/kit/4k/profiles/lowlight/lowlight_r0225c8/osd_sink1.json",
      "stream_id": "sink1"
    }
  ],
  "iq_settings": "/etc/imaging/cfg/hailo15h/imx678/kit/4k/profiles/lowlight/lowlight_r0225c8/iq_settings.json",
  "sensor_config": "/etc/imaging/cfg/hailo15h/imx678/kit/4k/profiles/lowlight/lowlight_r0225c8/sensor_config.json",
  "stabilizer_settings": "/etc/imaging/cfg/hailo15h/imx678/kit/4k/profiles/lowlight/lowlight_r0225c8/stabilizer_settings.json"
}
