{
  "version": "1.0.0",
  "metadata": {
    "architecture": "hailo15l",
    "content_hash": "1529b89b7f252ed2d56b98fb6ec20aa00a2f73775358b5fce30c33ead4c1ddaf",
    "description": "",
    "generation_timestamp": "2026-01-15T14:49:09.881205+00:00"
  },
  "application_settings": "/etc/imaging/cfg/hailo15l/imx675/kit/5mp/profiles/HDR/dynamic_privacy_mask_HDR/application_settings.json",
  "encoded_output_streams": [
    {
      "encoding": "/etc/imaging/cfg/hailo15l/imx675/kit/5mp/profiles/HDR/dynamic_privacy_mask_HDR/encoder_sink0.json",
      "masking": "/etc/imaging/cfg/hailo15l/imx675/kit/5mp/profiles/HDR/dynamic_privacy_mask_HDR/masking_sink0.json",
      "osd": "/etc/imaging/cfg/hailo15l/imx675/kit/5mp/profiles/HDR/dynamic_privacy_mask_HDR/osd_sink0.json",
      "stream_id": "sink0"
    },
    {
      "encoding": "/etc/imaging/cfg/hailo15l/imx675/kit/5mp/profiles/HDR/dynamic_privacy_mask_HDR/encoder_sink1.json",
      "masking": "",
      "osd": "/etc/imaging/cfg/hailo15l/imx675/kit/5mp/profiles/HDR/dynamic_privacy_mask_HDR/osd_sink1.json",
      "stream_id": "sink1"
    }
  ],
  "iq_settings": "/etc/imaging/cfg/hailo15l/imx675/kit/5mp/profiles/HDR/dynamic_privacy_mask_HDR/iq_settings.json",
  "sensor_config": "/etc/imaging/cfg/hailo15l/imx675/kit/5mp/profiles/HDR/dynamic_privacy_mask_HDR/sensor_config.json",
  "stabilizer_settings": "/etc/imaging/cfg/hailo15l/imx675/kit/5mp/profiles/HDR/dynamic_privacy_mask_HDR/stabilizer_settings.json"
}
