{
  "version": "1.0.0",
  "metadata": {
    "architecture": "hailo15h",
    "content_hash": "b9e4d3b4acc5d6991ede99640f3819972105aaac8c4fd654222e41de34c4562b",
    "description": "",
    "generation_timestamp": "2026-01-25T17:32:12.866923+00:00"
  },
  "application_settings": "/etc/imaging/cfg/hailo15h/imx715/theia_sl410m/4k/profiles/HDR/dynamic_privacy_mask_HDR/application_settings.json",
  "encoded_output_streams": [
    {
      "encoding": "/etc/imaging/cfg/hailo15h/imx715/theia_sl410m/4k/profiles/HDR/dynamic_privacy_mask_HDR/encoder_sink0.json",
      "masking": "/etc/imaging/cfg/hailo15h/imx715/theia_sl410m/4k/profiles/HDR/dynamic_privacy_mask_HDR/masking_sink0.json",
      "osd": "/etc/imaging/cfg/hailo15h/imx715/theia_sl410m/4k/profiles/HDR/dynamic_privacy_mask_HDR/osd_sink0.json",
      "stream_id": "sink0"
    },
    {
      "encoding": "/etc/imaging/cfg/hailo15h/imx715/theia_sl410m/4k/profiles/HDR/dynamic_privacy_mask_HDR/encoder_sink1.json",
      "masking": "",
      "osd": "/etc/imaging/cfg/hailo15h/imx715/theia_sl410m/4k/profiles/HDR/dynamic_privacy_mask_HDR/osd_sink1.json",
      "stream_id": "sink1"
    }
  ],
  "iq_settings": "/etc/imaging/cfg/hailo15h/imx715/theia_sl410m/4k/profiles/HDR/dynamic_privacy_mask_HDR/iq_settings.json",
  "sensor_config": "/etc/imaging/cfg/hailo15h/imx715/theia_sl410m/4k/profiles/HDR/dynamic_privacy_mask_HDR/sensor_config.json",
  "stabilizer_settings": "/etc/imaging/cfg/hailo15h/imx715/theia_sl410m/4k/profiles/HDR/dynamic_privacy_mask_HDR/stabilizer_settings.json"
}
