{
  "version": "1.0.0",
  "metadata": {
    "architecture": "hailo15l",
    "content_hash": "cf9ad2727503390a76f6802f7945a82c5bfeb19fefefb3b5665498098d4a3f1d",
    "description": "License plate recognition profile (denoise HDR)",
    "generation_timestamp": "2026-05-06T14:17:10.653485+00:00"
  },
  "application_settings": "/etc/imaging/cfg/hailo15l/imx678/theia_sl410m/4k/profiles/lowlight/webserver_lowlight_bayer_hdr/application_settings_detection.json",
  "encoded_output_streams": [
    {
      "encoding": "/etc/imaging/cfg/hailo15l/imx678/theia_sl410m/4k/profiles/lowlight/webserver_lowlight_bayer_hdr/encoder_sink0.json",
      "masking": "/etc/imaging/cfg/hailo15l/imx678/theia_sl410m/4k/profiles/lowlight/webserver_lowlight_bayer_hdr/masking_sink0.json",
      "osd": "/etc/imaging/cfg/hailo15l/imx678/theia_sl410m/4k/profiles/lowlight/webserver_lowlight_bayer_hdr/osd_sink0.json",
      "stream_id": "sink0"
    }
  ],
  "iq_settings": "/etc/imaging/cfg/hailo15l/imx678/theia_sl410m/4k/profiles/lowlight/webserver_lowlight_bayer_hdr/iq_settings.json",
  "sensor_config": "/etc/imaging/cfg/hailo15l/imx678/theia_sl410m/4k/profiles/lowlight/webserver_lowlight_bayer_hdr/sensor_config.json",
  "stabilizer_settings": "/etc/imaging/cfg/hailo15l/imx678/theia_sl410m/4k/profiles/lowlight/webserver_lowlight_bayer_hdr/stabilizer_settings.json"
}
