{
  "version": "1.0.0",
  "metadata": {
    "architecture": "hailo15l",
    "content_hash": "87f4142c308c53754482b8305b84463cfc1d23e7e47aed221eb0ace216fcf5a1",
    "description": "",
    "generation_timestamp": "2026-04-15T07:50:15.642907+00:00"
  },
  "application_settings": "/etc/imaging/cfg/hailo15l/imx662/theia_sl410m/fhd/profiles/daylight/face_landmarks_daylight/application_settings.json",
  "encoded_output_streams": [
    {
      "encoding": "/etc/imaging/cfg/hailo15l/imx662/theia_sl410m/fhd/profiles/daylight/face_landmarks_daylight/encoder_sink0.json",
      "masking": "/etc/imaging/cfg/hailo15l/imx662/theia_sl410m/fhd/profiles/daylight/face_landmarks_daylight/masking_sink0.json",
      "osd": "/etc/imaging/cfg/hailo15l/imx662/theia_sl410m/fhd/profiles/daylight/face_landmarks_daylight/osd_sink0.json",
      "stream_id": "sink0"
    },
    {
      "encoding": "/etc/imaging/cfg/hailo15l/imx662/theia_sl410m/fhd/profiles/daylight/face_landmarks_daylight/encoder_sink1.json",
      "masking": "/etc/imaging/cfg/hailo15l/imx662/theia_sl410m/fhd/profiles/daylight/face_landmarks_daylight/masking_sink1.json",
      "osd": "/etc/imaging/cfg/hailo15l/imx662/theia_sl410m/fhd/profiles/daylight/face_landmarks_daylight/osd_sink1.json",
      "stream_id": "sink1"
    }
  ],
  "iq_settings": "/etc/imaging/cfg/hailo15l/imx662/theia_sl410m/fhd/profiles/daylight/face_landmarks_daylight/iq_settings.json",
  "sensor_config": "/etc/imaging/cfg/hailo15l/imx662/theia_sl410m/fhd/profiles/daylight/face_landmarks_daylight/sensor_config.json",
  "stabilizer_settings": "/etc/imaging/cfg/hailo15l/imx662/theia_sl410m/fhd/profiles/daylight/face_landmarks_daylight/stabilizer_settings.json"
}
