{
  "version": "1.0.0",
  "metadata": {
    "architecture": "hailo15h",
    "content_hash": "50ac6b4bea560e8d558d18ef4f0983fdacf3bee8701a226fe53e20cc7b391af4",
    "description": "",
    "generation_timestamp": "2026-03-19T09:53:25.816063+00:00"
  },
  "application_settings": "/etc/imaging/cfg/hailo15h/imx715/theia_sl410m/4k/profiles/daylight/frontend_example_daylight/application_settings.json",
  "encoded_output_streams": [
    {
      "encoding": "/etc/imaging/cfg/hailo15h/imx715/theia_sl410m/4k/profiles/daylight/frontend_example_daylight/encoder_sink0.json",
      "masking": "/etc/imaging/cfg/hailo15h/imx715/theia_sl410m/4k/profiles/daylight/frontend_example_daylight/masking_sink0.json",
      "osd": "/etc/imaging/cfg/hailo15h/imx715/theia_sl410m/4k/profiles/daylight/frontend_example_daylight/osd_sink0.json",
      "stream_id": "sink0"
    },
    {
      "encoding": "/etc/imaging/cfg/hailo15h/imx715/theia_sl410m/4k/profiles/daylight/frontend_example_daylight/encoder_sink1.json",
      "masking": "/etc/imaging/cfg/hailo15h/imx715/theia_sl410m/4k/profiles/daylight/frontend_example_daylight/masking_sink1.json",
      "osd": "/etc/imaging/cfg/hailo15h/imx715/theia_sl410m/4k/profiles/daylight/frontend_example_daylight/osd_sink1.json",
      "stream_id": "sink1"
    }
  ],
  "iq_settings": "/etc/imaging/cfg/hailo15h/imx715/theia_sl410m/4k/profiles/daylight/frontend_example_daylight/iq_settings.json",
  "sensor_config": "/etc/imaging/cfg/hailo15h/imx715/theia_sl410m/4k/profiles/daylight/frontend_example_daylight/sensor_config.json",
  "stabilizer_settings": "/etc/imaging/cfg/hailo15h/imx715/theia_sl410m/4k/profiles/daylight/frontend_example_daylight/stabilizer_settings.json"
}
