{
  "version": "1.0.0",
  "metadata": {
    "architecture": "hailo15h",
    "content_hash": "51977246f15e6b09a51976799baffcbde384563b9163f675f8b926c449e8fe48",
    "description": "",
    "generation_timestamp": "2025-11-24T12:15:22.282830+00:00"
  },
  "application_settings": "/etc/imaging/cfg/hailo15h/imx715/kit/4k/profiles/daylight/webserver_daylight/application_settings.json",
  "encoded_output_streams": [
    {
      "encoding": "/etc/imaging/cfg/hailo15h/imx715/kit/4k/profiles/daylight/webserver_daylight/encoder_sink0.json",
      "masking": "",
      "osd": "/etc/imaging/cfg/hailo15h/imx715/kit/4k/profiles/daylight/webserver_daylight/osd_sink0.json",
      "stream_id": "sink0"
    }
  ],
  "iq_settings": "/etc/imaging/cfg/hailo15h/imx715/kit/4k/profiles/daylight/webserver_daylight/iq_settings.json",
  "sensor_config": "/etc/imaging/cfg/hailo15h/imx715/kit/4k/profiles/daylight/webserver_daylight/sensor_config.json",
  "stabilizer_settings": "/etc/imaging/cfg/hailo15h/imx715/kit/4k/profiles/daylight/webserver_daylight/stabilizer_settings.json"
}
