{
  "version": "1.0.0",
  "metadata": {
    "architecture": "hailo15l",
    "content_hash": "edc28dbd1231f7e90d866ce87c7d8fd6a5372eb2e8b79f8aaa923d65d41090e4",
    "description": "",
    "generation_timestamp": "2026-01-28T16:02:48.200790+00:00"
  },
  "application_settings": "/etc/imaging/cfg/hailo15l/imx675/theia_sl410m/5mp/profiles/daylight/webserver_daylight/application_settings_clip.json",
  "encoded_output_streams": [
    {
      "encoding": "/etc/imaging/cfg/hailo15l/imx675/theia_sl410m/5mp/profiles/daylight/webserver_daylight/encoder_sink0.json",
      "masking": "",
      "osd": "/etc/imaging/cfg/hailo15l/imx675/theia_sl410m/5mp/profiles/daylight/webserver_daylight/osd_clip.json",
      "stream_id": "sink0"
    },
    {
      "encoding": "/etc/imaging/cfg/hailo15l/imx675/theia_sl410m/5mp/profiles/daylight/clip_example_daylight/encoder_vga.json",
      "masking": "",
      "osd": "/etc/imaging/cfg/hailo15l/imx675/theia_sl410m/5mp/profiles/daylight/webserver_daylight/osd_clip.json",
      "stream_id": "clip_vga"
    }
  ],
  "iq_settings": "/etc/imaging/cfg/hailo15l/imx675/theia_sl410m/5mp/profiles/daylight/webserver_daylight/iq_settings.json",
  "sensor_config": "/etc/imaging/cfg/hailo15l/imx675/theia_sl410m/5mp/profiles/daylight/webserver_daylight/sensor_config.json",
  "stabilizer_settings": "/etc/imaging/cfg/hailo15l/imx675/theia_sl410m/5mp/profiles/daylight/webserver_daylight/stabilizer_settings.json"
}
