{
  "version": "1.0.0",
  "metadata": {
    "architecture": "hailo15h",
    "content_hash": "aacfa0412dbff759c87988b2be80f2a3c955c7b943e91cbe2a13d0778bc70b76",
    "description": "",
    "generation_timestamp": "2025-11-24T12:15:21.540809+00:00"
  },
  "application_settings": "/etc/imaging/cfg/hailo15h/imx678/theia_sl410m/4k/profiles/daylight/single_stream_daylight/application_settings.json",
  "encoded_output_streams": [
    {
      "encoding": "/etc/imaging/cfg/hailo15h/imx678/theia_sl410m/4k/profiles/daylight/single_stream_daylight/encoder_sink0.json",
      "masking": "/etc/imaging/cfg/hailo15h/imx678/theia_sl410m/4k/profiles/daylight/single_stream_daylight/masking_sink0.json",
      "osd": "/etc/imaging/cfg/hailo15h/imx678/theia_sl410m/4k/profiles/daylight/single_stream_daylight/osd_sink0.json",
      "stream_id": "sink0"
    }
  ],
  "iq_settings": "/etc/imaging/cfg/hailo15h/imx678/theia_sl410m/4k/profiles/daylight/single_stream_daylight/iq_settings.json",
  "sensor_config": "/etc/imaging/cfg/hailo15h/imx678/theia_sl410m/4k/profiles/daylight/single_stream_daylight/sensor_config.json",
  "stabilizer_settings": "/etc/imaging/cfg/hailo15h/imx678/theia_sl410m/4k/profiles/daylight/single_stream_daylight/stabilizer_settings.json"
}
