{
  "version": "1.0.0",
  "metadata": {
    "architecture": "hailo15h",
    "content_hash": "cad521ecc44d54f245551430d1c2b672802d364342b0252f9f2fefcad81411ce",
    "description": "",
    "generation_timestamp": "2025-11-24T12:15:21.598169+00:00"
  },
  "application_settings": "/etc/imaging/cfg/hailo15h/imx678/theia_sl410m/4k/profiles/daylight/ai_example_dual_sensor_sensor_1_daylight/application_settings.json",
  "encoded_output_streams": [
    {
      "encoding": "/etc/imaging/cfg/hailo15h/imx678/theia_sl410m/4k/profiles/daylight/ai_example_dual_sensor_sensor_1_daylight/encoder_sink0.json",
      "masking": "",
      "osd": "/etc/imaging/cfg/hailo15h/imx678/theia_sl410m/4k/profiles/daylight/ai_example_dual_sensor_sensor_1_daylight/osd_sink0.json",
      "stream_id": "sink0"
    }
  ],
  "iq_settings": "/etc/imaging/cfg/hailo15h/imx678/theia_sl410m/4k/profiles/daylight/ai_example_dual_sensor_sensor_1_daylight/iq_settings.json",
  "sensor_config": "/etc/imaging/cfg/hailo15h/imx678/theia_sl410m/4k/profiles/daylight/ai_example_dual_sensor_sensor_1_daylight/sensor_config.json",
  "stabilizer_settings": "/etc/imaging/cfg/hailo15h/imx678/theia_sl410m/4k/profiles/daylight/ai_example_dual_sensor_sensor_1_daylight/stabilizer_settings.json"
}
