{
  "version": "1.0.0",
  "metadata": {
    "architecture": "hailo15h",
    "content_hash": "99d16f3c8999ee01a2ba40b0b2ce2fce09ac8ca48fad84ed682efcbfd25c16f1",
    "description": "",
    "generation_timestamp": "2026-03-19T09:53:26.630502+00:00"
  },
  "application_settings": "/etc/imaging/cfg/hailo15h/imx678/theia_sl410m/4k/profiles/HDR/frontend_example_jpeg_HDR/application_settings.json",
  "encoded_output_streams": [
    {
      "encoding": "/etc/imaging/cfg/hailo15h/imx678/theia_sl410m/4k/profiles/HDR/frontend_example_jpeg_HDR/encoder_sink0.json",
      "masking": "/etc/imaging/cfg/hailo15h/imx678/theia_sl410m/4k/profiles/HDR/frontend_example_jpeg_HDR/masking_sink0.json",
      "osd": "/etc/imaging/cfg/hailo15h/imx678/theia_sl410m/4k/profiles/HDR/frontend_example_jpeg_HDR/osd_sink0.json",
      "stream_id": "sink0"
    },
    {
      "encoding": "/etc/imaging/cfg/hailo15h/imx678/theia_sl410m/4k/profiles/HDR/frontend_example_jpeg_HDR/encoder_sink1.json",
      "masking": "/etc/imaging/cfg/hailo15h/imx678/theia_sl410m/4k/profiles/HDR/frontend_example_jpeg_HDR/masking_sink1.json",
      "osd": "/etc/imaging/cfg/hailo15h/imx678/theia_sl410m/4k/profiles/HDR/frontend_example_jpeg_HDR/osd_sink1.json",
      "stream_id": "sink1"
    }
  ],
  "iq_settings": "/etc/imaging/cfg/hailo15h/imx678/theia_sl410m/4k/profiles/HDR/frontend_example_jpeg_HDR/iq_settings.json",
  "sensor_config": "/etc/imaging/cfg/hailo15h/imx678/theia_sl410m/4k/profiles/HDR/frontend_example_jpeg_HDR/sensor_config.json",
  "stabilizer_settings": "/etc/imaging/cfg/hailo15h/imx678/theia_sl410m/4k/profiles/HDR/frontend_example_jpeg_HDR/stabilizer_settings.json"
}
