{
  "version": "1.0.0",
  "metadata": {
    "architecture": "hailo15l",
    "content_hash": "1ec40b36196e14dc3df465125c98a88f4a17cbba1c1e0919f2a7dcf2511b0ef8",
    "description": "",
    "generation_timestamp": "2026-03-04T12:18:28.201853+00:00"
  },
  "application_settings": "/etc/imaging/cfg/hailo15l/imx662/theia_sl410m/fhd/profiles/lowlight/webserver_lowlight_bayer/application_settings.json",
  "encoded_output_streams": [
    {
      "encoding": "/etc/imaging/cfg/hailo15l/imx662/theia_sl410m/fhd/profiles/lowlight/webserver_lowlight_bayer/encoder_sink0.json",
      "masking": "/etc/imaging/cfg/hailo15l/imx662/theia_sl410m/fhd/profiles/lowlight/webserver_lowlight_bayer/masking_sink0.json",
      "osd": "/etc/imaging/cfg/hailo15l/imx662/theia_sl410m/fhd/profiles/lowlight/webserver_lowlight_bayer/osd_sink0.json",
      "stream_id": "sink0"
    }
  ],
  "iq_settings": "/etc/imaging/cfg/hailo15l/imx662/theia_sl410m/fhd/profiles/lowlight/webserver_lowlight_bayer/iq_settings.json",
  "sensor_config": "/etc/imaging/cfg/hailo15l/imx662/theia_sl410m/fhd/profiles/lowlight/webserver_lowlight_bayer/sensor_config.json",
  "stabilizer_settings": "/etc/imaging/cfg/hailo15l/imx662/theia_sl410m/fhd/profiles/lowlight/webserver_lowlight_bayer/stabilizer_settings.json"
}
