{
  "version": "1.0.0",
  "metadata": {
    "architecture": "hailo15h",
    "content_hash": "a4431932cb6518e7d21a392e2c23f19e89a4f6ff51f7a6c536d27e8b351d72db",
    "description": "",
    "generation_timestamp": "2026-03-18T13:31:38.940951+00:00"
  },
  "application_settings": "/etc/imaging/cfg/hailo15h/imx678/kit/4k/profiles/daylight/face_landmarks_dual_sensor_sensor_0_daylight/application_settings.json",
  "encoded_output_streams": [
    {
      "encoding": "/etc/imaging/cfg/hailo15h/imx678/kit/4k/profiles/daylight/face_landmarks_dual_sensor_sensor_0_daylight/encoder_sink0.json",
      "masking": "",
      "osd": "/etc/imaging/cfg/hailo15h/imx678/kit/4k/profiles/daylight/face_landmarks_dual_sensor_sensor_0_daylight/osd_sink0.json",
      "stream_id": "sink0"
    },
    {
      "encoding": "/etc/imaging/cfg/hailo15h/imx678/kit/4k/profiles/daylight/face_landmarks_dual_sensor_sensor_0_daylight/encoder_sink1.json",
      "masking": "",
      "osd": "/etc/imaging/cfg/hailo15h/imx678/kit/4k/profiles/daylight/face_landmarks_dual_sensor_sensor_0_daylight/osd_sink1.json",
      "stream_id": "sink1"
    }
  ],
  "iq_settings": "/etc/imaging/cfg/hailo15h/imx678/kit/4k/profiles/daylight/face_landmarks_dual_sensor_sensor_0_daylight/iq_settings.json",
  "sensor_config": "/etc/imaging/cfg/hailo15h/imx678/kit/4k/profiles/daylight/face_landmarks_dual_sensor_sensor_0_daylight/sensor_config.json",
  "stabilizer_settings": "/etc/imaging/cfg/hailo15h/imx678/kit/4k/profiles/daylight/face_landmarks_dual_sensor_sensor_0_daylight/stabilizer_settings.json"
}
