{
  "version": "1.0.0",
  "metadata": {
    "architecture": "hailo15l",
    "content_hash": "489c8205c5426248edc2ecf5d786817323404767b7d60a6e0b28bf085aba476c",
    "description": "",
    "generation_timestamp": "2025-11-24T12:15:22.990746+00:00"
  },
  "application_settings": "/etc/imaging/cfg/hailo15l/imx675/kit/5mp/profiles/daylight/clip_example_daylight/application_settings.json",
  "encoded_output_streams": [
    {
      "encoding": "/etc/imaging/cfg/hailo15l/imx675/kit/5mp/profiles/daylight/clip_example_daylight/encoder_highres.json",
      "masking": "/etc/imaging/cfg/hailo15l/imx675/kit/5mp/profiles/daylight/clip_example_daylight/masking_highres.json",
      "osd": "/etc/imaging/cfg/hailo15l/imx675/kit/5mp/profiles/daylight/clip_example_daylight/osd_highres.json",
      "stream_id": "HighRes"
    },
    {
      "encoding": "/etc/imaging/cfg/hailo15l/imx675/kit/5mp/profiles/daylight/clip_example_daylight/encoder_vga.json",
      "masking": "/etc/imaging/cfg/hailo15l/imx675/kit/5mp/profiles/daylight/clip_example_daylight/masking_vga.json",
      "osd": "/etc/imaging/cfg/hailo15l/imx675/kit/5mp/profiles/daylight/clip_example_daylight/osd_vga.json",
      "stream_id": "VGA"
    }
  ],
  "iq_settings": "/etc/imaging/cfg/hailo15l/imx675/kit/5mp/profiles/daylight/clip_example_daylight/iq_settings.json",
  "sensor_config": "/etc/imaging/cfg/hailo15l/imx675/kit/5mp/profiles/daylight/clip_example_daylight/sensor_config_play_from_file.json",
  "stabilizer_settings": "/etc/imaging/cfg/hailo15l/imx675/kit/5mp/profiles/daylight/clip_example_daylight/stabilizer_settings.json"
}
