{
  "version": "1.0.0",
  "metadata": {
    "architecture": "hailo15l",
    "content_hash": "8f8262ac0eff5036cd4f86db44dda2d2c68dda9303f5b1ef0fcc13dd4d384964",
    "description": "",
    "generation_timestamp": "2025-11-24T12:15:22.325399+00:00"
  },
  "application_settings": "/etc/imaging/cfg/hailo15l/imx678/theia_sl410m/4k/profiles/HDR/webserver_HDR/application_settings.json",
  "encoded_output_streams": [
    {
      "encoding": "/etc/imaging/cfg/hailo15l/imx678/theia_sl410m/4k/profiles/HDR/webserver_HDR/encoder_sink0.json",
      "masking": "/etc/imaging/cfg/hailo15l/imx678/theia_sl410m/4k/profiles/HDR/webserver_HDR/masking_sink0.json",
      "osd": "/etc/imaging/cfg/hailo15l/imx678/theia_sl410m/4k/profiles/HDR/webserver_HDR/osd_sink0.json",
      "stream_id": "sink0"
    }
  ],
  "iq_settings": "/etc/imaging/cfg/hailo15l/imx678/theia_sl410m/4k/profiles/HDR/webserver_HDR/iq_settings.json",
  "sensor_config": "/etc/imaging/cfg/hailo15l/imx678/theia_sl410m/4k/profiles/HDR/webserver_HDR/sensor_config.json",
  "stabilizer_settings": "/etc/imaging/cfg/hailo15l/imx678/theia_sl410m/4k/profiles/HDR/webserver_HDR/stabilizer_settings.json"
}
